{
  "$id": "https://hyoban.cc/data/schema/v3/collection.schema.json",
  "$schema": "https://json-schema.org/draft/2020-12/schema",
  "type": "object",
  "properties": {
    "uid": {
      "type": "string",
      "pattern": "^[0-9A-HJKMNP-TV-Z]{26}$"
    },
    "slug": {
      "type": "string",
      "pattern": "^[a-z0-9]+(?:-[a-z0-9]+)*$"
    },
    "kind": {
      "type": "string",
      "const": "trip"
    },
    "title": {
      "type": "string",
      "minLength": 1
    },
    "span": {
      "type": "object",
      "properties": {
        "start": {
          "anyOf": [
            {
              "type": "string",
              "pattern": "^\\d{4}-\\d{2}-\\d{2}$"
            },
            {
              "type": "string",
              "pattern": "^\\d{4}-\\d{2}-\\d{2}T\\d{2}:\\d{2}(?::\\d{2})?(?:Z|[+-]\\d{2}:\\d{2})$"
            }
          ]
        },
        "end": {
          "anyOf": [
            {
              "type": "string",
              "pattern": "^\\d{4}-\\d{2}-\\d{2}$"
            },
            {
              "type": "string",
              "pattern": "^\\d{4}-\\d{2}-\\d{2}T\\d{2}:\\d{2}(?::\\d{2})?(?:Z|[+-]\\d{2}:\\d{2})$"
            }
          ]
        }
      },
      "required": [
        "start",
        "end"
      ],
      "additionalProperties": {}
    },
    "include": {
      "default": [],
      "type": "array",
      "items": {
        "type": "string",
        "pattern": "^[0-9A-HJKMNP-TV-Z]{26}$"
      }
    },
    "exclude": {
      "default": [],
      "type": "array",
      "items": {
        "type": "string",
        "pattern": "^[0-9A-HJKMNP-TV-Z]{26}$"
      }
    },
    "covers": {
      "default": [],
      "type": "array",
      "items": {
        "type": "object",
        "properties": {
          "entry": {
            "type": "string",
            "pattern": "^[0-9A-HJKMNP-TV-Z]{26}$"
          },
          "media": {
            "type": "string",
            "pattern": "^[0-9A-HJKMNP-TV-Z]{26}$"
          }
        },
        "required": [
          "entry",
          "media"
        ],
        "additionalProperties": {}
      }
    },
    "visibility": {
      "type": "string",
      "enum": [
        "public",
        "private"
      ]
    },
    "facets": {
      "type": "object",
      "propertyNames": {
        "type": "string"
      },
      "additionalProperties": {}
    },
    "route": {
      "type": "object",
      "properties": {
        "straightLegs": {
          "default": [],
          "type": "array",
          "items": {
            "type": "object",
            "properties": {
              "from": {
                "type": "string",
                "pattern": "^[a-z0-9]+(?:-[a-z0-9]+)*$"
              },
              "to": {
                "type": "string",
                "pattern": "^[a-z0-9]+(?:-[a-z0-9]+)*$"
              },
              "by": {
                "type": "string",
                "enum": [
                  "ferry",
                  "plane",
                  "train"
                ]
              }
            },
            "required": [
              "from",
              "to",
              "by"
            ],
            "additionalProperties": {}
          }
        },
        "sameWayBack": {
          "default": [],
          "type": "array",
          "items": {
            "type": "object",
            "properties": {
              "from": {
                "type": "string",
                "pattern": "^[a-z0-9]+(?:-[a-z0-9]+)*$"
              },
              "to": {
                "type": "string",
                "pattern": "^[a-z0-9]+(?:-[a-z0-9]+)*$"
              }
            },
            "required": [
              "from",
              "to"
            ],
            "additionalProperties": {}
          }
        }
      },
      "additionalProperties": {}
    },
    "music": {
      "type": "string",
      "pattern": "^[a-z0-9]+(?:-[a-z0-9]+)*$"
    },
    "note": {
      "type": "string"
    },
    "createdAt": {
      "type": "string",
      "pattern": "^\\d{4}-\\d{2}-\\d{2}T\\d{2}:\\d{2}(?::\\d{2})?(?:Z|[+-]\\d{2}:\\d{2})$"
    },
    "updatedAt": {
      "type": "string",
      "pattern": "^\\d{4}-\\d{2}-\\d{2}T\\d{2}:\\d{2}(?::\\d{2})?(?:Z|[+-]\\d{2}:\\d{2})$"
    }
  },
  "required": [
    "uid",
    "kind",
    "title",
    "span",
    "createdAt",
    "updatedAt"
  ],
  "additionalProperties": {}
}
