{
  "uid": "01M5N5TZ2GQ11Y5B0XEFEWD698",
  "slug": "2025-hangzhou-day-trip",
  "kind": "trip",
  "title": "杭州一日",
  "span": {
    "start": "2025-12-27",
    "end": "2025-12-27"
  },
  "include": [],
  "exclude": [],
  "covers": [
    {
      "entry": "01KDFEWG2R4X60MN8WK5GA1N8J",
      "media": "01KDFEWG2S8WWFMY9MF777F86K"
    },
    {
      "entry": "01KDG14APG86NGEC0THQRPV34E",
      "media": "01KDG14APH6Y5NHYYVQJVZXWCX"
    },
    {
      "entry": "01KDG1NCK8M4XVZ962TDFWW76Q",
      "media": "01KDG1NCK99D19FE7XVK139ZEN"
    },
    {
      "entry": "01KDG14APG86NGEC0THQRPV34E",
      "media": "01KDG14APJ3XF3DN5JVW6JV5P3"
    },
    {
      "entry": "01KDG14APG86NGEC0THQRPV34E",
      "media": "01KDG14APKWSR0TPBB5PVJW41D"
    }
  ],
  "note": "From the apartment in Suzhou, while working there for a while; there and back the same day, the car passing its first 10,000 km.",
  "createdAt": "2026-10-24T04:04:34+08:00",
  "updatedAt": "2026-10-24T00:54:27Z"
}
