{
  "uid": "01KQFHWN000VZ51FVFQVBHTW7C",
  "slug": "2026-may-day-road-trip",
  "kind": "trip",
  "title": "五一皖赣自驾",
  "span": {
    "start": "2026-05-01",
    "end": "2026-05-05"
  },
  "include": [],
  "exclude": [],
  "covers": [
    {
      "entry": "01KQMK7QR0PQBPX1JG2PA4ETZZ",
      "media": "01KQMK7QR4RPSE4AXTJXKT9XXZ"
    },
    {
      "entry": "01KQMK7QR0PQBPX1JG2PA4ETZZ",
      "media": "01KQMK7QR273BR7J3DPD9Z0BWR"
    },
    {
      "entry": "01KQMK7QR0PQBPX1JG2PA4ETZZ",
      "media": "01KQMK7QR33MCPGP1ZT58X9PQ0"
    },
    {
      "entry": "01KQMK7QR0PQBPX1JG2PA4ETZZ",
      "media": "01KQMK7QR6T3B7YGHM28SWNYC9"
    },
    {
      "entry": "01KQMK7QR0PQBPX1JG2PA4ETZZ",
      "media": "01KQMK7QR1KSPRA5E67D79XYK3"
    },
    {
      "entry": "01KQMPP300J2AJ2P2A5WN3MGCM",
      "media": "01KQMPP301EP7842WTJWFNCHE0"
    },
    {
      "entry": "01KQMK7QR0PQBPX1JG2PA4ETZZ",
      "media": "01KQMK7QR558N3HHVY7P4Y9ZCQ"
    },
    {
      "entry": "01KQH05128E9Y63YC960B2GGMZ",
      "media": "01KQH0512B9TB5QJKEHF3RATVY"
    },
    {
      "entry": "01M5MC7845H3E2B9AMJZWSJAH4",
      "media": "01KQMPP304YF9G9MESQ1QAYP24"
    }
  ],
  "createdAt": "2026-05-01T00:00:00+08:00",
  "updatedAt": "2026-10-23T12:41:01Z"
}
